{
  "$schema": "http://json-schema.org/draft-07/schema#",
  "$id": "https://paree.nl/climbpro/schema/v3/payload.json",
  "title": "ClimbPayload",
  "description": "Canonical wire-format payload (v3, packed) sent from the Android companion app to the Garmin Connect IQ apps over the Communications API. Uses short keys and packed integer arrays to minimise bytes. Produced by service/ClimbPayloadBuilder; consumed by the hand-written Monkey C parsers (garmin*/source/CommListener.mc and garmin-surface/source/SurfaceData.mc). protocol/examples/*.json are canonical wire samples; ProtocolRoundTripTest validates both the examples and the live builder output against this schema.",
  "type": "object",
  "additionalProperties": false,
  "required": ["v", "mode", "climbs"],
  "properties": {
    "v": {
      "description": "Wire schema version. Consumers reject any value other than 3.",
      "type": "integer",
      "minimum": 3,
      "maximum": 3
    },
    "mode": {
      "description": "'route' = follow a single route (climbs carry sd/ed); 'radius' = nearby climbs (climbs carry slat/slon).",
      "type": "string",
      "enum": ["route", "radius"]
    },
    "routeId": {
      "description": "Stable route identifier (route mode). Absent in radius mode.",
      "type": "string",
      "minLength": 1,
      "maxLength": 64
    },
    "name": {
      "description": "Optional user/display name for the route. Only emitted when <= 32 chars.",
      "type": "string",
      "maxLength": 32
    },
    "rtl": {
      "description": "Route mode (optional): total route length in whole metres. The watch derives distance-along-course as (rtl - Activity.Info.distanceToDestination) when navigating.",
      "type": "integer",
      "minimum": 1
    },
    "surfSec": {
      "description": "Surface/named flat sections (route mode), sent in the lean surface-datafield payload (with climbs: []). Ordered by start distance.",
      "type": "array",
      "maxItems": 32,
      "items": { "$ref": "#/definitions/SurfaceSection" }
    },
    "climbs": {
      "description": "Climbs. Route mode: ordered by sd. Radius mode: ordered closest-first.",
      "type": "array",
      "maxItems": 64,
      "items": { "$ref": "#/definitions/Climb" }
    },
    "hz": {
      "description": "Route mode (optional, issue #203): hazard markers packed as [startM, endM, type, ...], 3 ints per hazard, ordered by startM. type 0 = road tunnel (OpenStreetMap, 'licht aan'), 1 = technical descent (steep or bendy, detected from the route geometry). Distances in whole metres from the route start. At most 32 hazards; omitted when none, and dropped when the payload would exceed the byte budget.",
      "type": "array",
      "maxItems": 96,
      "items": { "type": "integer", "minimum": 0 }
    },
    "fss": {
      "description": "Specialized starred flat segments (route mode), shown as a separate list section in the widget. Only segments with an assigned surface (t 0-4) are sent. Omitted when none qualify.",
      "type": "array",
      "maxItems": 32,
      "items": { "$ref": "#/definitions/FlatStarredSection" }
    }
  },
  "definitions": {
    "Climb": {
      "type": "object",
      "additionalProperties": false,
      "required": ["len", "eg", "ag", "segs"],
      "properties": {
        "sd": {
          "description": "Route mode: cumulative distance (m) along the route where the climb starts.",
          "type": "integer",
          "minimum": 0
        },
        "ed": {
          "description": "Route mode: cumulative distance (m) along the route where the climb ends.",
          "type": "integer",
          "minimum": 0
        },
        "slat": {
          "description": "Radius mode: climb start latitude as degrees x 100000 (integer).",
          "type": "integer"
        },
        "slon": {
          "description": "Radius mode: climb start longitude as degrees x 100000 (integer).",
          "type": "integer"
        },
        "len": {
          "description": "Climb length in metres. Domain rule: >= 800.",
          "type": "integer",
          "minimum": 800
        },
        "eg": {
          "description": "Total elevation gain in metres (rounded).",
          "type": "integer"
        },
        "ag": {
          "description": "Average gradient as fixed-point percent x 10 (7.2% -> 72).",
          "type": "integer"
        },
        "n": {
          "description": "Optional user/display name for the climb (<= 32 chars).",
          "type": "string",
          "maxLength": 32
        },
        "segs": {
          "description": "Packed segments: [distance, elevationGain, gradientFixedPoint, colorIndex, ...], 4 ints per segment. gradientFixedPoint = percent x 10; colorIndex 0-5 (see colors.md).",
          "type": "array",
          "minItems": 4,
          "items": { "type": "integer" }
        },
        "calib": {
          "description": "Route mode (optional): packed GPS calibration points [distanceFromClimbStart, latInt, lonInt, ...], 3 ints per point. latInt/lonInt = degrees x 100000.",
          "type": "array",
          "items": { "type": "integer" }
        },
        "surf": {
          "description": "Optional: one surface-type code (0-5) per segment, parallel to segs. Omitted when all segments are UNKNOWN.",
          "type": "array",
          "items": { "type": "integer", "minimum": 0, "maximum": 5 }
        },
        "tsec": {
          "description": "Route mode (optional): per-segment target time in whole seconds, one int per segment, parallel to segs. Manual, power-based pacing plan. Omitted when no pacing plan is available.",
          "type": "array",
          "items": { "type": "integer", "minimum": 0 }
        },
        "refsec": {
          "description": "Route mode (optional): per-segment PR reference time in whole seconds, one int per segment, parallel to segs. The fastest previous split ever recorded on that exact segment (across all attempts, not necessarily the same attempt) — used to render a live 'ahead/behind your PR' delta. Distinct from 'tsec' (a manual pacing target); both may be present. Omitted when no attempt with a matching segment count exists.",
          "type": "array",
          "items": { "type": "integer", "minimum": 0 }
        },
        "vam": {
          "description": "Optional: packed gradient-implied VAM (vertical ascent m/h) per segment: [avgVamMPerH, peakVamMPerH, ...], 2 ints per segment, parallel to segs. Derived from gradient at a fixed reference climbing speed (routes carry no elapsed-time data, so this is a planning estimate, not a measured ascent rate); peak is the steepest short window within the segment. Omitted unless every segment has a computed value.",
          "type": "array",
          "items": { "type": "integer" }
        },
        "ib": {
          "description": "Optional interval block (issue #180): [targetWatts, lowWatts, highWatts], the power band to hold from the foot to the top of this climb. Computed on the phone from the block's % FTP and the rider's FTP. Omitted when the climb has no block or no FTP is set.",
          "type": "array",
          "minItems": 3,
          "maxItems": 3,
          "items": { "type": "integer", "minimum": 1 }
        },
        "zc": {
          "description": "Optional (issue #66): per-segment FTP intensity-zone color, one colorIndex (0-5, see colors.md 'FTP intensity zones') per segment, parallel to segs. A second, optional color source next to the gradient colorIndex in segs, which stays the default: the watch uses zc only when its 'Kleurmodus' setting is FTP-zone. Computed on the phone from the rider's FTP and weights (estimated segment power -> Coggan zone -> colorIndex). Both modes; omitted without a complete rider profile, and dropped from any payload that would otherwise exceed the 4 KB budget.",
          "type": "array",
          "items": { "type": "integer", "minimum": 0, "maximum": 5 }
        }
      }
    },
    "FlatStarredSection": {
      "type": "object",
      "additionalProperties": false,
      "required": ["s", "e", "t"],
      "properties": {
        "s": { "description": "Metres from route start where the segment begins.", "type": "integer", "minimum": 0 },
        "e": { "description": "Metres from route start where the segment ends (> s).", "type": "integer", "minimum": 1 },
        "t": { "description": "SurfaceType: 0=asphalt 1=gravel 2=dirt 3=cobblestone 4=mixed.", "type": "integer", "minimum": 0, "maximum": 4 },
        "n": { "description": "Optional display name (<= 24 chars).", "type": "string", "maxLength": 24 }
      }
    },
    "SurfaceSection": {
      "type": "object",
      "additionalProperties": false,
      "required": ["s", "e", "t", "cp"],
      "properties": {
        "s": {
          "description": "Metres from route start where the section begins.",
          "type": "integer",
          "minimum": 0
        },
        "e": {
          "description": "Metres from route start where the section ends (> s).",
          "type": "integer",
          "minimum": 1
        },
        "t": {
          "description": "SurfaceType: 0=asphalt 1=gravel 2=dirt 3=cobblestone 4=mixed 5=unknown.",
          "type": "integer",
          "minimum": 0,
          "maximum": 5
        },
        "n": {
          "description": "Optional user-supplied section name (<= 24 chars).",
          "type": "string",
          "maxLength": 24
        },
        "cp": {
          "description": "Packed GPS checkpoints [distanceFromRouteStart, latInt, lonInt, ...], 3 ints per checkpoint. latInt/lonInt = degrees x 100000. May be empty.",
          "type": "array",
          "items": { "type": "integer" }
        }
      }
    }
  }
}
