{
  "v": 3,
  "mode": "route",
  "routeId": "demo_route_full",
  "name": "Full demo climb",
  "rtl": 8000,
  "climbs": [
    {
      "sd": 1000,
      "ed": 3000,
      "len": 2000,
      "eg": 80,
      "ag": 40,
      "n": "Long Drag",
      "segs": [
        500, 20, 40, 1,
        500, 20, 40, 1,
        500, 20, 40, 1,
        500, 20, 40, 1
      ],
      "calib": [
        0, 5150000, 510000,
        1000, 5151000, 510500,
        2000, 5152000, 511000
      ],
      "surf": [1, 1, 0, 0],
      "tsec": [60, 62, 64, 66],
      "refsec": [58, 59, 61, 63],
      "vam": [
        504, 560,
        504, 540,
        504, 580,
        504, 520
      ],
      "ib": [273, 266, 280],
      "zc": [3, 3, 4, 3]
    }
  ],
  "hz": [
    3400, 3650, 0,
    5200, 6100, 1
  ]
}
